Description,folio
"<m>☾</m>, which is like <m>very base solder</m>",147v
"<tl><fr>bullitoire</fr></tl>, like any alloys which resemble, however",147v
"two or three <ms>grains, like <pa>peas</pa></ms>, of <m>sal",147v
ammoniac</m>. This clarified it like a mirror. Once very white from the,147v
"&amp; thin like <m>paper</m>, &amp; hollow on the reverse. But because",147v
"Do not let it cool when melting. It always makes a tail, like <m>melted",147v
become red like <m>copper</m> &amp; you would need to reheat it &amp;,148r
"finger</bp> can almost enter it</ms>, widening like a <fr>clervoise</fr>",148v
"<m>sublimate</m> than the others. Wet all of this together like paste,",149r
"<ms>grain</ms> of the <m>fine alloy</m>, like <cn>old",149v
"<ab>For hollow things like <al>turtles</al>, <ms>half</ms> <m>fine",150r
"the hole, like for other <tl>molds</tl>. And then temper your <m>molding sand</m>",150v
"the gate when the <tl>mold</tl> is in several pieces, like a",150v
"has melted, if there is no fanciful thing which could break, like some",151r
"only have very thin &amp; very weak things to cast, like flowers, rely",151r
"<tl>mold</tl>, <del><fr>qu</fr></del> they meet up &amp; join like",151r
"legs of a small animal, like a <al>fly</al> &amp; suchlike. It is also",151v
"legs of a small animal, like a <al>fly</al> &amp; suchlike. It is also",151v
"cast; you can therefore shave them with fire, like <del><fr>d</fr></del><comment rid=""c_052r_02""/>",152r
"is made of scaly circles, nearly like the one of a <al>lizard</al>,",152r
"<m>sand</m>; next, uncover it like other animals, &amp; make the second cast.",152r
"<m>biggish bones</m>, like a <al>bird</al> or <al>rat</al>, without",152r
"hollow, like your seal, &amp; your <fr>noyau</fr> will render it molded,",153r
"<tl>chisel</tl>, wet it &amp; you will cut it like <m>glass</m>.</ab>",154r
"is not well ground, like <m><la>crocum</la></m>, it goes to the bottom,",154r
little <m>tin</m> to make it run better. It always leaves a tail like,154v
"the flower, like a <al>fly</al> or something similar, <m><al>fish</al>",155v
<m>silver</m> or any other <m>metal</m> you like. But to hasten your,156r
"<ab>Cast a <al>lizard</al> or any medal you like in <m>base silver</m>,",156r
"like <cn>billon</cn>. Next, <m>gild</m> it lightly. And once the first",156r
"like the first time, &amp; do thus three or four times or more,",156r
"better, to place them on something like a leaf, or similar thing, to",156v
"one needs to repair &amp; retrace it all. Otherwise, it would look like a",159r
"<ab>It is molded like the <pa>rose</pa>, <pa>marigold</pa> &amp; all",159v
"burned <del>you</del>, like <al>crayfish</al>, you cannot open it to",159v
"hardens in it, like <m>the one of <pl>Paris</pl> &amp;",159v
grows in <env>lean &amp; dry earth</env> and which seems like,159v
"<ab>If they sleep <env>in <m>straw</m></env>, like they usually do,",160v
"surface of the <m>water</m>, &amp; continue to stir it thus, like the",161r
"<ab> <m>The one which is white, light like a sponge</m>, once burned in",162r
"the</del> like <m>cinnabar</m>, in <m>eau-de-vie</m>. And the ones and",163v
"give off red fumes like a volatile spirit if, being thus hot",163v
"When you make the gate of some delicate animal, like a <al>snake</al>,",164r
"like in the <tl>cupel</tl>, and makes it jump in little balls at the",164r
"silver</m>, like <cn>reals</cn> &amp; others, &amp; to put it in ingots",164r
"time</tmp>, for they act like <m>fatty earth</m>, which when drying by itself,",165r
"of a regular shape, but on the inside, they are made like a",167r
"<tl>gimlet</tl>-like point, may attach the <wp>petard</wp> faster &amp; without",167v
fork made like pincers</tl> &amp; another <tl><m>iron</m> rod,167v
"the entire point that is made like a <tl>gimlet</tl>, namely by three or",167v
something like a cocoon or</ab>,167v
"like a <tl>wimble</tl>,<comment rid=""c_168r_01""/> &amp; if the <wp>petard</wp>",168r
"<ab>A. This is a <tl>small peg, hooked like the hinge of a door</tl>",168r
"&amp; made like a <tl><oc>gimlet</oc></tl><comment rid=""c_080r_01""/> on one end, for quickly",168r
"passes, button-like on one end &amp; made like a",168r
"passes, button-like on one end &amp; made like a",168r
props up the <tl>fork made like pincers</tl> &amp; also supports the,168r
"<ab>H. <tl>Knife-like saws</tl> to cut a portcullis, if needed.</ab>",168v
"covered with <m>canvas</m>, like all the rest, to turn the <tl>large",168v
<head>Molding very thin like <pro><fr>bimbalotiers</fr></pro> do</head>,169v
"your <m>wetted sand <mark>#</mark><comment rid=""c_112r_02""/> like for <fr>noyau</fr></m>, &amp; in the",169v
<ab><m>perfume</m> &amp; suchlike. But take heed that it is,170r
"them, like the <tl>frame molds</tl> want to be <del><fr>recu</fr></del>",170r
<ab>They do not want to be cast in <m>lead</m> or <m>red tin</m> like,170r